data_coleta,titulo,resumo,instituicao,nivel,area,vagas,inscricoes_inicio,inscricoes_fim,url,status,data_publicacao,fonte
2026-06-07T15:49:30.607378Z,Edital UNEB 050/2026 - Seleção de Aluno Especial - PPGEduC (Semestre 2026.2),"Processo Seletivo para aluno de matrícula especial em disciplinas dos cursos de Mestrado e Doutorado do Programa de Pós-Graduação em Educação e Contemporaneidade (PPGEduC) da UNEB, ofertado pelo Departamento de Educação (DEDC), Campus I.",UNEB,Aluno Especial,Educação,15,2026-06-15T09:00:00Z,2026-07-06T23:59:59Z,https://portal.uneb.br/pos-graduacao/,Aberto,2026-06-06T10:00:00Z,PPGEduC UNEB
2026-06-07T15:49:30.607378Z,Edital UNEB 048/2026 - Seleção de Aluno Especial - PPGEL (Semestre 2026.2),"Processo seletivo para aluno de matrícula especial do Programa de Pós-Graduação em Estudo de Linguagens (PPGEL) da UNEB para o segundo semestre de 2026. Oferece 70 vagas distribuídas entre disciplinas das linhas de pesquisa de Leitura, Literatura e Cultura e Linguagens, Discurso e Sociedade.",UNEB,Aluno Especial,Humanas e Sociais,70,2026-06-29T09:00:00Z,2026-07-10T23:59:59Z,https://portal.uneb.br/pos-graduacao/,Aberto,2026-06-05T10:00:00Z,PPGEL UNEB
2026-06-07T15:49:30.607378Z,Edital IF Baiano 14/2026 - Aluno Especial - Produção Vegetal no Semiárido,O Instituto Federal Baiano abre inscrições para Alunos Especiais em disciplinas do Mestrado Profissional em Produção Vegetal no Semiárido no Campus Guanambi. Oportunidade para profissionais das Ciências Agrárias cursarem matérias isoladas.,IF Baiano,Aluno Especial,Agrárias e Ambientais,10,2026-06-09T09:00:00Z,2026-06-30T17:00:00Z,https://ifbaiano.edu.br/portal/ingresso-de-estudantes/pos-graduacao/,Aberto,2026-06-03T11:00:00Z,IF Baiano Guanambi
2026-06-07T15:49:30.607378Z,Chamada UNIVASF 05/2026 - Seleção para Aluno Especial - Engenharia Agrícola (Semestre 2026.2),Estão abertas as inscrições para aluno especial nas disciplinas de pós-graduação stricto sensu em Engenharia Agrícola da UNIVASF no campus de Juazeiro-BA. Foco em tecnologia de irrigação.,UNIVASF,Aluno Especial,Agrárias e Ambientais,8,2026-06-10T09:00:00Z,2026-07-10T23:59:59Z,https://portais.univasf.edu.br/pos-graduacao,Aberto,2026-06-02T10:00:00Z,UNIVASF Pos
2026-06-07T15:49:30.607378Z,Edital UFBA 02/2026 - Seleção de Aluno Especial - PGCOMP (Semestre 2026.2),O Programa de Pós-Graduação em Ciência da Computação da UFBA abre vagas para inscrição em disciplinas isoladas. Oportunidade para profissionais de TI cursarem matérias de Inteligência Artificial e Engenharia de Software no mestrado/doutorado.,UFBA,Aluno Especial,Tecnologia e Informática,18,2026-06-15T09:00:00Z,2026-07-05T23:59:59Z,https://sigaa.ufba.br/sigaa/public/processo_seletivo/lista.jsf,Aberto,2026-06-01T10:00:00Z,PGCOMP UFBA
